{"schema_version":"zerostack.cas-gc.v1","record_type":"pin","engine":"graphzero","project_id":"bbbbbbbbbbbbbbbbbbbbbbbbbbbbbbbbbbbbbbbbbbbbbbbbbbbbbbbbbbbbbbbb","pin_id":"release-2026-07","created_at":"2026-07-11T10:00:00Z","expires_at":"2026-07-12T10:00:00Z","blob_hash":"0123456789abcdef0123456789abcdef0123456789abcdef0123456789abcdef"}
